id,url,title,score,num_comments,created_utc,selftext
rbv8as,https://www.reddit.com/r/bulimia/comments/rbv8as/swollen_fingers/,Swollen fingers?,1,1,1638981491.0,"So I mostly purge by vomiting (I use lax occasionally) and today I noticed that the fingers I use to purge are extremely swollen. I have early Russell’s Sign (it’s not permanent, but I have it for about 12 hours after a purge, which happens to be most of my time awake since I purge daily, and one that has broken skin on a knuckle of that makes sense) so idk if that’s part of it? 

I only noticed because I used my other hand to avoid agitating the abrasion on my usual hand and at first I thought it was a change in angle but they’re even different visually. I can’t seem to find anything about this happening on Google lol so. Has this happened to anyone else?"
rbtz0r,https://www.reddit.com/r/bulimia/comments/rbtz0r/a_hair_in_my_cookie_made_me_stop_binging/,A hair in my cookie made me stop binging,19,0,1638977891.0,Lol i will literally eat everything normally but this was to much. Thank u hair
rbt7sb,https://www.reddit.com/r/bulimia/comments/rbt7sb/ive_completely_given_up/,I've completely given up,2,0,1638975685.0,"Fuck this, I get insane every time if I binge and purge but it is not even close to how insane I feel when I don't , the hunger the thoughts in my head food is all around me in the vessel's galley looking at me telling me to eat it and if I don't I'll have dreams of doing it,I fast every day eating too little calories before midnight binging and purging to not gain weight I feel that I look like shit I gained weight and I can't do nothing about the whole situation but feel bad about everything I don't even give a shot about the disorder I'm just looking at ways to have the ed but not gain weight"
rbstds,/r/AnorexiaNervosa/comments/rbrvb8/im_24_and_have_a_mouth_full_of_crowns_because_of/,I’m 24 and have a mouth full of crowns because of my eating disorder. Struggling to accept myself and past.,3,0,1638974535.0,
rbsgmc,https://www.reddit.com/r/bulimia/comments/rbsgmc/why_even_eat_the_food/,Why even eat the food?,57,6,1638973490.0,I ask myself this every time I purge. If I’m going to purge why do I even eat it! I don’t know why. I’m at the point where it can be healthy food but once that feeling of being too full hits it has to go. I hate this life. I want to stop but now it’s like pavlovs dog. Eat ; purge.
rbrwph,https://www.reddit.com/r/bulimia/comments/rbrwph/shit/,Shit,2,0,1638971837.0,I recently found a new thing that make me... without me actually forcing myself (no tips to find here dont even ask i just want to vent) and i cant stop... ive been using it for the past month and it makes me feel too good i fear im falling again into it...
rbrf88,https://www.reddit.com/r/bulimia/comments/rbrf88/i_told_one_of_my_closest_friends_about_my/,I told one of my closest friends about my struggles and then she ghosted me... who can I trust ? will my other best friends think I‘m crazy if I tell them ?,3,2,1638970289.0,"I‘ve been struggling with eating disorders (ana and bullimia) for 7 years. There were times in my life when it got better and I had the feeling that I was over it, until the beginning of this year, when I started purging again because I was in an extremely terrible state of mind.
My boyfriend treated me really terrible and told me in a 2 page letter how terrible I was, so I started spiraling down into my bad habits again. On top of that, I got really depressed, so when I realized that I couldn’t cope with it on my own anymore, I texted my „best“ friend. I told her about my boyfriend, how lonely and broken I was and that I started purging (again). All she knew about my ED History, was that I had serious struggles with anorexia when I was a young teenager. To protect myself (and I guess hide) I never told  her or anyone else, that I still had issues with my body image etc. So when I told her, she was extremely disgusted and didn’t have any nice things to say to me anymore to I guess encourage me ? She then told me to go to a psychologist and ever since then she never texted me again and never asked me how I was. This happened in June. She is a little overweight and has struggles with her body image too but she is extremely beautiful and kind hearted and I always felt so happy when I was around her. Did she maybe feel offended by me telling her about my ED when she herself fails to lose weight ? I honestly don‘t consider her my friend anymore since that happened because she never checked in on me again and treated me like I was trash. My issue is that no one else in my life knows about my struggles and seeing her reaction scared me to ever tell anyone else. Currently I am in the best headspace I ever had and I have no more issues with it at all and I am so proud of my self but I still want to share those things with someone... Do you think I can tell my best friends or my boyfriend about it or should I leave it in the past since it‘s not an issue in my life  anymore ? Did your friends/ family react similar ? (I also apologize for this looong post and any mistakes that I made, I never post on here and english is also not my native language) thank you and take care!!"
rbp5n6,https://www.reddit.com/r/bulimia/comments/rbp5n6/tw_i_swallowed_a_foreign_object/,Tw: I swallowed a foreign object,1,2,1638962351.0,[removed]
rbodmp,https://www.reddit.com/r/bulimia/comments/rbodmp/struggling/,struggling,8,2,1638959197.0,"i have been living w bulimia for a little less that two years now. in the summer i managed to lose a lot of weight without having a lot of episodes, and for the first time in a lot of years i was very happy with my body. when september started and my plans didn’t go as i wanted them to, i started gaining the weight back. now, i don’t even have the motivation to purge sometimes and i end up just binging and praying that i won’t gain a lot of weight. i am very unhappy with my body and i can’t stop looking at summer photos and videos, something that i know makes me more depressed but i get a weird high from it. i desperately want to continue losing weight and i miss the feeling of liking the way i look(i was never that underweight). since september i have been spiraling a lot and in the last few weeks i’ve been the most suicidal i’ve been in a very long time. i know i have to be patient but the fact that i can not discipline myself enough to lose weight doesn’t give much of a motive to me to keep living. i’ve been losing my drive for my dreams and i am kinda desperate."
rbo1t8,https://www.reddit.com/r/bulimia/comments/rbo1t8/i_took_a_bit_of_magnesium_and_i_shit_myself_while/,i took a bit of magnesium and i shit myself while binging in the kitchen,7,2,1638957850.0,talk about a walk of shame
rbna9e,https://www.reddit.com/r/bulimia/comments/rbna9e/trying_to_lose_weight_after_recovery/,Trying to lose weight after recovery,3,1,1638954754.0,"Hi everyone,
I'm happy to say that I've stopped puking all together now and it has definitely changed my life for better. My only problem now is that I gained weight because of many issues (recovery, studying and working from home because of lockdowns etc.) and this wasn't even a problem for a long time but when the lockdown was over I found myself struggling to do many activities because of my weight gain. I'm an overworking teacher and I walk/stand up a lot and I get exhausted when I come home, especially my feet hurt so bad. 
So my question is; how should i lose weight after recovery? I'm also considering registering myself to a gym but I know that I should also control my diet so what are your tips?"
rbkuc6,https://www.reddit.com/r/bulimia/comments/rbkuc6/my_mum_is_so_cute/,My mum is so cute,4,1,1638945225.0,[deleted]
rbk2xa,https://www.reddit.com/r/bulimia/comments/rbk2xa/im_searching_for_someone_arabic_and_muslim_who_i/,"I’m searching for someone arabic and muslim who i can speak with , & who can start with me new lifestyle without eating disorder and bulima 🥺 and thinking about weight 🙏🏻",5,0,1638942523.0,
rbjdsq,https://www.reddit.com/r/bulimia/comments/rbjdsq/moved_into_a_new_home_dumped_purge_into_garbage/,moved into a new home. dumped purge into garbage disposal and it is broken.,4,0,1638940111.0,"sigh. i need to stop this. i am tired of this cycle. it has my entire life in a chokehold and i can’t keep doing this. i want to recover so badly, but physically doing it feels impossible."
rbi0f1,https://www.reddit.com/r/bulimia/comments/rbi0f1/how_many_times_do_you_all_of_you_usually_binge/,how many times do you all of you usually binge eat? And advice?,2,3,1638935713.0,[removed]
rbhxe0,https://www.reddit.com/r/bulimia/comments/rbhxe0/deleted_by_user/,[deleted by user],10,1,1638935448.0,[removed]
rbhtd7,https://www.reddit.com/r/bulimia/comments/rbhtd7/deleted_by_user/,[deleted by user],1,1,1638935097.0,[removed]
rbhkq6,https://www.reddit.com/r/bulimia/comments/rbhkq6/throwing_up_as_a_form_of_catharsis/,Throwing up as a form of catharsis?,54,9,1638934352.0,Hello everyone. This post might be triggering and I apologize for that… I just don’t know who to talk to. I really thought I was done throwing up. Haven’t done it in about 8 years unless im sick and just need to feel better. I had a realization that back when I would binge and purge the purging wasn’t just about weight control. I had no healthy ways of emotional regulation back then and my purging served as an emotional release and reset for me. Like being reborn honestly. And ever since then I realized how much I miss that feeling… I’ve been eating more than usual recently and I think that has also been triggering me. But I was wondering if purging feels like that for anyone else?? Im honestly kinda worried I might relapse and I never thought I would get here. I thought I was done. Im scared and am finding myself wanting to restart something I thought was long gone despite knowing all the ways it harms me.
rbh794,https://www.reddit.com/r/bulimia/comments/rbh794/is_it_normal_to_get_cramps_near_your_rib_cage/,Is it normal to get cramps near your rib cage after purging?,4,2,1638933284.0,I’m on my period and I’ve been getting cramps bear my rib cage after purging and I just want to know if that’s normal.
rbgz3b,https://www.reddit.com/r/bulimia/comments/rbgz3b/how_to_get_rid_of_chipmunk_cheeks/,How to get rid of chipmunk cheeks?,9,7,1638932636.0,Basically what the title says. And please don’t say the obvious which is to stop purging😂 cause I know that one😭
rbd0og,https://www.reddit.com/r/bulimia/comments/rbd0og/i_need_some_help_with_some_ed_info/,I need some help with some Ed info,4,0,1638920921.0,"(16m)
Idk how an Ed but I has been some time that I been having some problems with my eating schedule, nothing really big is just I eat to little at 3pm like a normal eating time and when night comes and it’s time for dinner I eat way to much if I can and I tend to get hungry at afternoon, I wasn’t like this but I can’t remember for how much I has Been like this, can I be developing an Ed or something? Thank u for reading

Any help appreciated!! 
(Sorry for some bad English I’m not a native speaker but I try to make it make work)

Edit: just a little extra info, I don’t drink water much at all, for reference I have a water bottle in my room I haven’t even finished it( it has been over 2 weeks I believe) and It is a big water bottle like the ones that look like gallons if that makes sense

Edit 2: sorry for editing to much but I remember things after I posted this is a fast one

In the morning I feel really bad when I’m done eating and it hurts my stomach but only when y have an really early breakfast"
rbcxxc,https://www.reddit.com/r/bulimia/comments/rbcxxc/what_will_happen_to_me/,what will happen to me?,2,1,1638920711.0,[deleted]
rbcrz4,https://www.reddit.com/r/bulimia/comments/rbcrz4/dae_feel_like_a_puppet/,DAE feel like a puppet,11,3,1638920228.0,"I feel so hopeless. Every time, I try to recover and try to “fake it til I make it.” There is no making it. People say not to let your illness define you but that’s just me 24/7. 

I’m not even me at this point. I feel like I’m a puppet. Controlled by someone torturing a voodoo doll of me. 

Also, why are there so many comorbid disorders. When I try to manage severe anxiety, then my depression is literally a black hole. When I try to substitute out bad coping mechanisms, then whatever problem I have with food comes back full force. I don’t think I have a problem but I’m too scared to really talk about it in therapy so I wouldn’t know.


I just feel like I try to climb out of one whirlpool to slide down back into a deeper spiral.

Anyone else also feel like they’re fighting an invisible force but have been for so long you don’t even know who you are anymore and what’s it matter whether you exist or not if you feel like you’re nothing anyways so why keep living like this."
rbbicw,https://www.reddit.com/r/bulimia/comments/rbbicw/deleted_by_user/,[deleted by user],1,0,1638916652.0,[removed]
rbag3j,https://www.reddit.com/r/bulimia/comments/rbag3j/deleted_by_user/,[deleted by user],3,3,1638913746.0,[removed]
rbae79,https://www.reddit.com/r/bulimia/comments/rbae79/deleted_by_user/,[deleted by user],2,0,1638913594.0,[removed]
rb9x18,https://www.reddit.com/r/bulimia/comments/rb9x18/deleted_by_user/,[deleted by user],2,0,1638912282.0,[removed]
rb96gi,https://www.reddit.com/r/bulimia/comments/rb96gi/is_it_possible_too_still_have_an_ed_if_things/,is it possible too still have an ed if things like this happen,3,0,1638910294.0,"
for instance when im deep in my ed ill engage intensely in many behaviours & thoughts; and theres a devastating emotional impact but then depending on circumstance seemingly within days of eachother ill sometimes eat things id previously find too stressful to and eat alot/ or a normal amount. and not be too bothered or engage in compensatory behaviours or purging. sometimes feeling full will make me cry and sometimes i dont really care. or ill know i will have eaten over maintenance consistently for a few days or kinda binged- but tell myself ill wait till i feel the need to restrict and loose it all then. literally within days of eachother. 

it feels like i constantly am switching between the mindset of deep in my ed too a almost healthy 'normal' brain and eating. ( the thoughts r still there just quieter and i dont act on them as much/ dont have the energy or just dont *care* enough tbh. ) 
 
The normal eating with little guilt (not because it was safe foods or id compensated- just genuinley alright w eating it ) only lasts from about maybe a meal, sometimes a day or at most a week. but the thoughts are alot more present when its longer eating normally. 

its like either way ill always creep back too engaging in my ed and restriction,  trying too make it worse than last time. 
but if i really had an ed why is it sometimes so easy too flip back and forth between these eating and thought patterns. i dont choose too im sure but its so frustrating. im not ready too recover or eat/ feel normal for good- but i also feel i cant consistently restrict and its so frustrating. i cant restrict like i used too and miss how i looked. but also want to enjoy food when i am able too because the moments when i feel ok and alright r fleeting. 

its like i can never engage long enough in any behaviour too be considered a 'pure ed' in my head; binge restrict cycles, pure restriction, over exercising, purging, im just constantly going between them all and i hate it. 

 
idk. just feel so invalid and fake and undisciplined. is this even an ed. ugh"
rb8rdc,https://www.reddit.com/r/bulimia/comments/rb8rdc/deleted_by_user/,[deleted by user],2,0,1638909159.0,[removed]
rb7kex,https://www.reddit.com/r/bulimia/comments/rb7kex/deleted_by_user/,[deleted by user],1,0,1638905933.0,[removed]
rb57n7,https://www.reddit.com/r/bulimia/comments/rb57n7/deleted_by_user/,[deleted by user],1,0,1638900793.0,[removed]
rb40tk,https://www.reddit.com/r/bulimia/comments/rb40tk/i_forgot_what_the_old_me_was_like/,I forgot what the old me was like,103,14,1638898410.0,"I am 3 days purge free after months of failed recoveries and not keeping anything down. I feel… clean. No puke on the sleeves of my clothes, acne clearing up, my skin is less dry, I actually leave my room and talk to my roommates, calling my friends and family just to chat, responding to texts and emails, doing my school work. I know it is only 3 days in, and I am having to ignore the urges constantly still, but all of these are reasons to keep going. I look prettier, like I am happier, despite the bloat I do have. I am just allowing myself to wear baggy sweaters and comfy pants, knowing it will go down and my body is adapting and healing inside. We can all do this."
rb2o9l,https://www.reddit.com/r/bulimia/comments/rb2o9l/tw_gross/,tw: GROSS,39,3,1638894092.0,"i lived in my (16f) parents basement suite for awhile, it was my own place.
my depression and bulimia got so bad i spent my days on the couch just eating and puking for HOURS.
all around me was chip bags, containers, pots, pans, and bowls filled with my vomit 
some days old.
i stopped changing my pants every time i pissed myself and just sat there covered in my own piss.
the couch was pleather so it was saveable dw guys.
but yeah! just wanted to share that.
i’m doing better tho! we’re in a small apartment now so i don’t have privacy to puke but i also just haven’t felt the urge to
i’ve been doing really well this last week
i puked twice but just a lil bit :)"
razct7,https://www.reddit.com/r/bulimia/comments/razct7/i_havent_purged_for_two_days/,I haven't purged for two days!,107,5,1638884136.0,"I have been struggling with a purging disorder with an anorexic subtype (I restrict so that I don't trigger my purging) for a couple months, and it's been two days since I've purged! Every day there is some point where I feel full enough to do so, but I'm literally already feeling more resilient (I haven't had a huge meal in a while but this is a big deal for me)! I rarely purge full meals anyway (I usually don't even have that much in my system when I do) but this feels like a huge accomplishment"
ravtoq,https://www.reddit.com/r/bulimia/comments/ravtoq/relapse_feeling_like_a_failure_and_a_liar/,"Relapse, feeling like a failure and a liar",3,1,1638871454.0,[deleted]
rasyzk,https://www.reddit.com/r/bulimia/comments/rasyzk/triggering/,*Triggering*,3,1,1638859692.0,"This is my first post on this page so if anything isn’t correct/aligning with the rules, please let me know! 

Ive been bulimic (binge-purge) for over 8 years but it’s gotten worse over the last 1.5 years, due to stress. Recently, I don’t even have to try to make myself vomit using force. It’s as if my body is so used to expelling food that food has turned into a foreign object. I get so nauseated after eating anything and any amount and just throw up. At first, it was like my bulimic badge of honor, not shoving my finger down my throat, my body was doing what I wanted it to do without me forcing it to. Now it’s actually caused a lot of stress, I’m tired all day because absolutely nothing is staying down. 


Had this happened to anyone before and any advice on “good” food that we’ll help with this problem, like settling my stomach?"
rarpwv,https://www.reddit.com/r/bulimia/comments/rarpwv/how_long_until_cheek_swell_goes_away/,How long until cheek swell goes away,2,6,1638855004.0,My cheeks got kinda puffy and I hate how it looks. Anyone know how long it usually takes for swelling to disappear?
raqs6g,https://www.reddit.com/r/bulimia/comments/raqs6g/new_here_feeling_overwhelmed_scared/,New here… feeling overwhelmed & scared,6,0,1638851712.0,"I’m writing this Bc I’ve been trying so hard to find therapy/help through my insurance and I have had no luck. I really just need to vent, or share, or talk to someone because I’m starting to feel extremely alone and scared. I’m 30yo. I think I’ve always struggled with ED, showing up in various forms, and had a short period of purging once before but it only lasted a month or so and then 2 years went by without doing it and I summed it up in my mind as just a “phase” and thought it wouldn’t happen again. Well… I’ve been purging now for 8 months. It started off as intense restrictive dieting and only purging when I “needed” to. Then, the cravings started to intensify - makes sense- and so the purging increased to every weekend, Friday - Sunday.  (Mostly restrictive purging though. I had been trying to maintain a deficit). Then it turned into a combo of c/s and for the first time in my life, out-of-control binging. I had never felt what that was like before. But it is like a switch goes off in my mind- “I feel guilty for eating anyway, might as well eat more and get rid of it.” Now it’s been my fallback for everything- events, nights out with friends, even date nights. Who cares? The calories don’t count. Never mind it makes me feel ashamed and overwhelmed with guilt. I’ve lost a lot of weight and people are telling me how “amazing” I look - which only makes me want to keep the weight off. Now there are stretches of time when I purge daily, multiple times a day. I am worried about my health. But it’s like I can’t stop, idk how to overcome the terror of gaining weight. Ironically I’m the most confident I’ve ever felt in my body, I like the way I look. I finally feel comfortable wearing clothes that don’t hide my body. I don’t want to gain weight. But I’ve now started to notice some of the signs of my health being effected.. I’ve lost my periods… I’m usually regular. My nails are very thin and brittle and I feel like my teeth are starting to yellow and my hair is thinning (tho I can’t tell if that’s just in my head). When I do try to allow my body to eat- because I AM trying- I feel like my digestion’s not the same- I am constipated a lot now. And TMI: I also had blood in my stool for the very first time and I’m freaked out. It didn’t happen again, so I’m not sure what’s going on there or if it’s even related. All in all, I’m feeling lost and scared. I just want to get healthy. I don’t want to hurt myself like this anymore . I wish every time I told myself “this is the last time” it was really the last time. I feel like I can’t trust myself anymore and I’m afraid to tell anyone because I feel like a fraud…I’m embarrassed and ashamed 😓"
raq6ry,https://i.redd.it/djmg0bz7o1481.jpg,Do I look overweight? According to BMI I am overweight and it's making everything very difficult. (I'm an athlete btw),1,0,1638849758.0,[deleted]
rapwy7,https://www.reddit.com/r/bulimia/comments/rapwy7/deleted_by_user/,[deleted by user],4,1,1638848879.0,[removed]
rapfbn,https://www.reddit.com/r/bulimia/comments/rapfbn/struggling_with_body_dysmorphia/,Struggling with body dysmorphia,2,3,1638847343.0,"I have a history of eating disorders (anorexia and bulimia). I was a pretty chubby kid and bullied a lot into losing weight by classmates and family. I became anorexic by the age of 13. At 5’5” I was 85lbs. Incapable of getting up for a glass of water without feeling like I’m going to collapse. My parents didn’t want me to get help because they didn’t think it was a real disorder. I was essentially force fed and abused until I ate. The body dysmorphia remained but I had gained some weight by the age of 20 to stop the abuse. I moved out of my house but spiraled out of control with anxiety and toxicity from my family. I developed bulimia about a year ago.  I hate that I am hiding this from my boyfriend because all he wants to do is help me. I feel so guilty when I look at him. I’m started to develop really strong palpitations. Sometimes I feel like my heart is going to beat out of my chest, it’s just so loud it makes me panic! I want to stop ASAP. I need to stop.. it’s making my BPD worse. I keep getting into this loop with myself that I am harming my body, I can literally feel the effects, but I am “fat”. I know I am a normal weight (140 at 5’5” )but sometimes I want to stay in a baggy sweater all day because I can’t look at myself. Any advice to help me stop?"
rapa3p,https://www.reddit.com/r/bulimia/comments/rapa3p/tw_mention_of_restriction_sometimes_i_talk_to/,[TW: mention of restriction] sometimes I talk to myself as if I'm in one of those Harper's Bazaar videos and I don't know why,9,0,1638846883.0,[deleted]
rap8u9,https://www.reddit.com/r/bulimia/comments/rap8u9/deleted_by_user/,[deleted by user],1,0,1638846770.0,[removed]
raovj7,https://www.reddit.com/r/bulimia/comments/raovj7/can_someone_please_tell_me_i_dont_need_to_binge/,Can someone please tell me I don’t need to binge and purge,10,7,1638845627.0,I just bought all my food and feel already awful but part of me is bored and the other part is just itching for a b/p :( please give me some advice.
raoqn6,https://www.reddit.com/r/bulimia/comments/raoqn6/dont_drink_after_purging_and_restricting/,Don’t drink after purging and restricting,31,4,1638845199.0,"I’m classified as obese and I thought I could handle my liquor because of it. Wrong. My body folded on me I thought I was going to die. Nearly called an ambulance but was able to get most of it out of me and sleep. Just don’t do it. Don’t think about it, don’t do it. Do not drink on an empty stomach while hypoglycemic."
