id,url,title,score,num_comments,created_utc,selftext
rnjb46,https://www.reddit.com/r/bulimia/comments/rnjb46/the_holiday_binge/,The holiday binge,3,0,1640340429.0,"I'm assuming most of us are going through this odd holiday cycle. I’m a wrestler needing to stay at a certain weight and this has been the worst case over the last 3 years of whatever is going on with me and food. It’s just eat and purge. I hate the holidays. The last 3 years have been sour of trying to desperately not eat, eating, then purging, then trying to tone and get rid of the extra weight for wrestling/rugby. 

OH WELL LOL my goal is recovery. My obstacle is to reach it."
rnj70t,/r/Eatingdisordersover30/comments/rdn11q/welcome_to_reatingdisordersover30/,Welcome to r/Eatingdisordersover30!,2,0,1640339992.0,
rnh279,https://www.reddit.com/r/bulimia/comments/rnh279/im_new_and_worried_how_did_you_feel_your_first/,I'm new. And worried. How did you feel your first time? And what made you continue?,6,5,1640331125.0,[deleted]
rnguy8,https://www.reddit.com/r/bulimia/comments/rnguy8/deleted_by_user/,[deleted by user],1,0,1640330358.0,[removed]
rng12u,https://www.reddit.com/r/bulimia/comments/rng12u/how_does_one_stop/,how does one Stop,6,1,1640327190.0,I am genuinely going insane and am so upset with myself for b/ping 3 times today including the lovely xmas dinner my parents made and then waiting until they went to bed to help myself to leftovers and purge that too I genuinely don’t know how to stop and it’s horrible i’m graduating college soon and i’ve been stuck in this cycle for years and I don’t even know what my life would be without it how did those of u who have tried to/are recovered do it? i’m so lost and so tired
rnfbro,https://www.reddit.com/r/bulimia/comments/rnfbro/really_cool_relapse/,Really cool relapse 🙃,10,1,1640324653.0,I mean I’ve been relapsed for awhile but today was especially low. Now I remember why I should just not try and fucking eat solid food lol I’m so fucking triggered rn. You know what but tomorrow is a new fucking day and I don’t need to waste my days purging and binging. I will go to the fucking gym tomorrow and do productive shit. I will not fucking waste all my money on food that will inevitably be thrown up later. I will get my fucking body back before New Years eeve as to not look like a complete fat ass in all my pictures. I hate my fucking body.
rnewvk,https://www.reddit.com/r/bulimia/comments/rnewvk/im_still_bullshitting_myself_when_it_comes_to/,im still bullshitting myself when it comes to eating.,5,1,1640323253.0,"i'm getting my life together in a lot of great ways and im working hard. but one of the things that i still bullshit myself on is ""healthy eating habits"". 

i think 500cal or under is GOOD. thats what i aim for when i am fasting. realistically i know that is not good. but i push that thought aside and keep starving. nobody really knows anyways. better that way bc to be completely honest, i dont want to stop. so i'm going to keep it to myself and not stress others out about it when im not wanting to change right now. 

i cant stop thinking about food and it's making my brain feel itchy."
rnemxl,https://www.reddit.com/r/bulimia/comments/rnemxl/dae_also_have_a_list/,DAE also have a list ….,1,0,1640322325.0,[removed]
rnda8v,https://www.reddit.com/r/bulimia/comments/rnda8v/is_this_worse/,Is this worse?,17,10,1640317827.0,[deleted]
rnct62,https://www.reddit.com/r/bulimia/comments/rnct62/tw_any_similar_bad_habits_instead_of_binging/,TW (?) Any similar bad habits instead of binging?,1,1,1640316250.0,[removed]
rnc99t,https://www.reddit.com/r/bulimia/comments/rnc99t/extreme_hunger_or_binging/,Extreme hunger or binging :(,5,1,1640314448.0,"I was diagnosed with an b/p and have finally decided to go all in because nothing else was working, if I even had a touch of control I would obsess over clean eating, calories which would lead to purging. All in for me if facing ALL of my fear foods eating breakfast lunch and dinner plus intuitive eating outside of meals. After a meal I am extremely bloated but after 30 mins I find myself so hungry and craving very high calorific foods even though I’m having carbs protein and veg with each meal (eg last night I had sweet potato fries a salad and some crumbled fish) and not mentally restricting. Today I have literally not stopped eating and my stomach feels like a black hole!! I didn’t even know it was possible to keep down the amount of food I’m eating... 
I feel like I’m justifying my binges because I’m under weight and I’m tricking myself into feeling hungry? Idk if that makes sense... it’s just tricky since I heavily restrict but also binge and purge so I don’t feel like I’m allowed to have extreme hunger IF that’s what I’m experiencing
Any advice would be appreciated I feel like I’m going crazy"
rnc63m,https://www.reddit.com/r/bulimia/comments/rnc63m/tw_calorie_numbers_what_do_you_consider_a_high/,tw calorie numbers/ what do you consider a high calorie meal?,2,4,1640314171.0,A while ago I used to feel guilty if it was over 100 calories but now if it's more than 40 I'll be fucking worried. And actually if I give it TOO MUCH thought anything above 10 calories becomes terrifying.
rnbzza,https://www.reddit.com/r/bulimia/comments/rnbzza/do_any_of_you_actually_see_your_weight_loss/,Do any of you actually see your weight loss?,36,19,1640313606.0,"I used to see depictions of people who lost significant amounts of weight from EDs where they look in the mirror and still see themselves as fat, and I would think, ""that can't really be possible, you would be able to look at yourself objectively and see that you're skinny at that point, right?"" 

And yet, I'm here, 60 pounds less than I was, looking in the mirror, and still seeing a fat girl. I see the number on the scale go down. The old clothes getting looser. The sizing on new clothes I have to buy getting smaller. I see the other physical changes in my body - the thinning and brittle hair, the awful skin, the dark eye circles. I hear the comments from people about the amount of weight I've lost. But I look at my body itself, and it looks the same as it always has. And I mean that so literally. 

How can a sick mind be so powerful?"
rnbzoj,https://www.reddit.com/r/bulimia/comments/rnbzoj/fasting_instead_of_vomiting/,fasting instead of vomiting,3,1,1640313581.0,"is fasting after a binge classified as bulimia? if so, then how long do the fasts have to be to fit the bulimia criteria?"
rna48m,https://www.reddit.com/r/bulimia/comments/rna48m/deleted_by_user/,[deleted by user],16,3,1640307555.0,[removed]
rn9epl,https://www.reddit.com/r/bulimia/comments/rn9epl/am_i_the_only_one_who_thinks_that_im_eating_way/,Am i the only one who thinks that i’m eating way more than anyone here mentions as “a lot”?,100,22,1640305299.0,"Like every time i see a post mentioning some food they have just binged i feel awful cause never even close to how much am i actually binging on. I tried to count today approximately and it comes out it’s about 7-8 k every single day. No wonder why i gain weight. haha. lol. 

Is what i’m thinking true or do anybody else feel the same way? (ok, maybe it’s not the right community, it’s probably more a BED)"
rn9cxp,https://www.reddit.com/r/bulimia/comments/rn9cxp/restricting_more/,restricting more,5,0,1640305155.0,"just had a horrible binge , been a while since a binge this bad i feel… probably bc i was hungry but had a family dinner tonight and ddidnt want to eat until the dinner… but ended up home alone and just all the restricting mindset made me binge like a madman….. purged as well but didnt get everything out and just feeling bloated, swollen, and awful. my love hate relationship with the holidays is rlly showing through rn"
rn6u9x,https://www.reddit.com/r/bulimia/comments/rn6u9x/sores_on_hands/,Sores on hands,1,6,1640297768.0,[removed]
rn50of,https://www.reddit.com/r/bulimia/comments/rn50of/does_anyone_find_it_hard_to_purge_oreos/,Does anyone find it hard to purge oreos?,7,12,1640292664.0,[removed]
rn4ijv,https://www.reddit.com/r/bulimia/comments/rn4ijv/bp_bread/,B/p bread,1,1,1640291220.0,[removed]
rn3g17,https://www.reddit.com/r/bulimia/comments/rn3g17/shit_day/,Shit day,6,1,1640288154.0,So I suffer from severe anorexia and bulimia (and uses to have Ortband binge eating disorder) and today I binged so so so badly on like thousands and thousands and thousands of calories and I threw up so much that at the end it was like 10-20% blood and I’m in so much pain and I just wish it would stop but until my bpd gets any better it’ll just get worse for me and I can’t wait u til after xmas so I can finally kill myself bc j can’t take bpd and what it entails anymlre
rn0rur,https://www.reddit.com/r/bulimia/comments/rn0rur/small_confused_rant/,Small confused rant,2,1,1640280830.0,"For context, my ED hasn’t caused my period to stop as of current. 

This month I’ve had no period cravings or b/p particularly different, my whole period ‘side effects’ have seemed to change over the past few months as well as the period itself so this wasn’t exactly concerning to say it was normal before. 2 days ago weighed myself and was fine with my weight, but then I did yesterday and found I had a huge weight flux. I know with the Ed weight fluctuates but I feel this time I can see it and can’t wear certain clothes because of the way they feel on my body. I just can’t tell if it’s my period with the weight fluctuation or if I have actually gained weight and it’s making me lose all motivation to eat while battling the urge to b/p. It should finish in a few days but I’m just concerned if the weight doesn’t drop off afterwards because I’m going to beat myself up. It’s Christmas soon as well and I’m genuinely scared for what I have to eat and what I will do with it as well as not having the mental capacity to be around people and family members."
rmzfdg,https://www.reddit.com/r/bulimia/comments/rmzfdg/deleted_by_user/,[deleted by user],12,10,1640277174.0,[removed]
rmxce2,https://www.reddit.com/r/bulimia/comments/rmxce2/dae_use_cs_to_control_binges_and_prevent_purging/,DAE use c/s to control binges and prevent purging?,6,2,1640271284.0,"so for the past month or so I've begun developing certain ED behaviours, I don't know what's happening besides my mental health generally being in the dumpster rn. I think this is because I have just been looking for ways to control myself and one of the issues I knew I needed to wrangle under control was how often I binged.

I would buy whole sleeves of digestives (a type of biscuit/cookie basically) and eat them all in one sitting, I would buy giant boxes of cereal and eat several bowls in a few hours, I was just eating because it felt good and I was looking for a way of getting that under control and it led to me thinking of purging.

I knew that was a problem though, I knew about long term health risks and to stop that I started just chewing food and spitting it out. This let me ""binge"" without actually gaining any weight, and without having to vomit all the time either. It seemed like a win-win situation, no health risks and it got my binge eating under control.

But it turns out c/s has some health risks too, chewing signals your stomach to release more acid, and not swallowing means that acid has no food to digest and can cause things like stomach ulcers and shit if continued. I'm not sure what to do. I'm not sure how to stop or control this anymore, it feels like every solution there is either doesn't work or comes with significant health risks. I mean, c/s is better than purging by far but I still end up purging if I must eat in a social setting and have no way to c/s. Does anyone else do this sort of thing?"
rmwu5k,https://www.reddit.com/r/bulimia/comments/rmwu5k/has_anyone_else_gotten_numb_lips_after_purging/,Has anyone else gotten numb lips after purging?,3,3,1640269729.0,No doc I’ve had in the past has explained it....right now I’m post purge and so tired. My lips are numb and tingling again. It’s a fairly common post-purge reaction I get. What the hell causes it? Headache too
rmpego,https://www.reddit.com/r/bulimia/comments/rmpego/there_are_so_many_bad_things_about_this_disease/,there are so many bad things about this disease but one of them is not being able to get the food out and dealing with the binge. awful.,10,2,1640241577.0,"I’m down to one b/p a week. From daily, sometimes multiple times a day, to one a week. Progress."
rmo6yp,https://www.reddit.com/r/bulimia/comments/rmo6yp/deleted_by_user/,[deleted by user],24,3,1640237312.0,[removed]
rmltil,https://www.reddit.com/r/bulimia/comments/rmltil/i_really_did_it_triggered_myself_no_details_at/,"I really did it - triggered myself. No details, at all, I promise.",4,0,1640228435.0,"Oh, you guys…I just triggered the living hell out of myself. And while I expected it, it wasn’t in *this* way. I can’t give details for my own sensibilities, let alone what I experienced. So where I’m asking for support is, how does one get rid of that ghastly, disgusted feeling that comes from such deep stuff? Ugh, why did I do this?! 

And really, this is not anything like a typical trigger. It’s way the f out there. I have the same feeling that I get from trypophobia images (fear of holes and patterns) - and it wasn’t that! It’s like a disgusted dread. But for me, it’s connected to my ED."
rmlgm7,https://www.reddit.com/r/bulimia/comments/rmlgm7/how_can_i_support_my_girlfriend/,How can i support my girlfriend,3,2,1640227303.0,[deleted]
rml4d3,https://www.reddit.com/r/bulimia/comments/rml4d3/deleted_by_user/,[deleted by user],1,1,1640226231.0,[removed]
rmkvn7,https://www.reddit.com/r/bulimia/comments/rmkvn7/constant_nausea/,Constant nausea?,8,4,1640225474.0,[deleted]
rmkbhq,https://www.reddit.com/r/bulimia/comments/rmkbhq/cant_stop_binging/,cant stop binging,3,2,1640223696.0,"today i wasnt going to binge because i was planning on going out and have fun with my family, but once they got home they immediately started screaming at me and then left without me. so i was left home alone feeling angry and upset so i ended up binging and when i tried to purge it i hardly got anything up, it came up really slowly and it hurt really bad and i ended up trying so hard that i couldnt breathe and nearly passed out. so now im still super bloated and feel so gross and want to die. how do i stop binging? how do i feel better somebody pls help me idk what to do"
rmk1kn,https://www.reddit.com/r/bulimia/comments/rmk1kn/need_some_opinions_feel_so_lost_and_confused/,Need some opinions - feel so lost and confused about my eating disorder diagnosis.,6,4,1640222809.0,"I have been bingeing and throwing up on and off for four years now. It’s hard to say how often, I know I’ve gone weeks maybe months without but as far as I can recently recall, it’s a few times a week, and sometimes multiple times a day a few times a week, most weeks. 

I’ve always told myself it wasn’t a big deal and it’s always the last time and that it was just a secret tool I had in my back pocket to stay a certain weight or a friend when Im depressed - but I’m starting to feel like it’s worse than I’m admitting to myself. 

I’ve thrown up at work, I’ve thrown up at family functions, I’ve thrown up immediately after eating and hours later and sometimes rush home to try to get it out, I’ve thrown up while traveling, I’ve thrown up blood, and mostly it’s just me bingeing and purging in my own apartment. 

I would never have identified myself with an eating disorder, and was sure I had this under control. But I recently wrote in my gratitude journal that the one thing I was thankful for one day was that I didn’t  throw up. 

I had an intake call with a therapist from the Emily program on Monday. She recommended me to residential treatment and asked what more it’s going to take for me to admit I am sick. 

Since then Ive been very confused because I swore she was going to tell me I was a mild case. I can’t stop wondering is the therapist jumping to conclusions, am I capable of stopping this outside of residential treatment, did I misspeak and make it seem worse than it was? 

I’ve also been convinced that I can stop since this call on Monday - that I’m actually magically healed there’s no need for something as intense as four plus weeks in residential treatment and I am a mild case. I genuinely said wow now that I’ve admitted it I think it’s gone! 

But then today I binged and threw up again. And I am struggling so badly right now with hunger and sadness and fear of eating. I am so afraid I’m going to binge and purge again tonight. 

I keep thinking if I read the right books or just work out regularly or get good sleep and eat healthy foods I’ll stop doing this and this feeling will go away - but I’ve done those things and yes it leads to days or weeks I’m doing great, but here I am again looking myself in the mirror wiping my mouth clean and seeing my bloodshot eyes. 

Does anyone have input? Do you think residential treatment could actually be warranted? Or is it overkill? I’d have to take fmla leave and I’m in a corporate leadership position - it’d be so much “easier” and cheaper to work on this another way. 

Thank you so much for reading."
rmivkf,https://www.reddit.com/r/bulimia/comments/rmivkf/my_body_cant_handle_it_a_second_time/,My body can’t handle it a second time,8,1,1640219185.0,[deleted]
rmiscy,https://www.reddit.com/r/bulimia/comments/rmiscy/festive_anxiety/,Festive anxiety,3,3,1640218905.0,"Damnnn you festive anxiety. As a bulimic, I have this dread that the little devil will appear on my shoulder on Christmas Day family dinner time and say “go on, go wild, just pardon yourself afterwards and get rid of it all” 😔"
rmieki,https://www.reddit.com/r/bulimia/comments/rmieki/holidays/,Holidays,4,2,1640217771.0,I was sober for one year in October. Then Thanksgiving came. (I missed thanksgiving the previous year because I got married and then I missed Christmas because I had covid) I wasn't prepared to deal with the fact everyone binge eats on Holidays and I relapsed and purged on Thanksgiving. I've purged one other time since. With Christmas coming I'm terrified. What are some coping skills that help you get through the holidays? I would really like to go back to being sober. I also start therapy on Tuesday because I think I might have body dysmorphia and I am really struggling. Any advice would be amazing. This is the worst addiction. I can't avoid food so I have to figure out how to cope.
rmhaty,https://www.reddit.com/r/bulimia/comments/rmhaty/dae_bp_and_then_b_again_but_not_p/,DAE b/p and then b again but not p,16,5,1640214454.0,i do this so often and idk if its bc my body is tired or if i just give up but i feel so invalid when i do it idk why?? like i know im still messed up T__T
rmf9rw,/r/EdAnonymousAdults/comments/rmf9kk/you_chose_not_to_eat_i_guess_so/,“You chose not to eat”… I guess so,1,0,1640208529.0,[deleted]
rmf9hw,https://www.reddit.com/r/bulimia/comments/rmf9hw/i_dont_know_what_to_do/,I don't know what to do,1,0,1640208505.0,[deleted]
rme2zp,https://www.reddit.com/r/bulimia/comments/rme2zp/cant_stop_binging/,Can’t stop binging,1,0,1640205115.0,[deleted]
rmdwpw,https://www.reddit.com/r/bulimia/comments/rmdwpw/does_your_gag_reflex_come_back/,Does your gag reflex come back?,17,16,1640204605.0,Mine is completely gone.
rmdpmn,https://www.reddit.com/r/bulimia/comments/rmdpmn/i_rarely_binge_but_i_still_purge_even_after/,i rarely binge but i still purge even after eating the smallest of foods is this still bulimia?,11,12,1640204042.0,[removed]
rm9u46,https://www.reddit.com/r/bulimia/comments/rm9u46/its_so_hard_to_keep_food_down/,it's so hard to keep food down,5,2,1640193314.0,"i think i'm gonna cave in, it's coming up on its own anyways. i know i've messed up my health so badly and i'm so terrified but i'm also terrified of gaining and i feel so sick"
rm98pu,https://www.reddit.com/r/bulimia/comments/rm98pu/deleted_by_user/,[deleted by user],1,6,1640191702.0,[removed]
rm7c2h,https://www.reddit.com/gallery/rm7c2h,30 days difference (broke my streak once),1,4,1640186389.0,
rm6zxg,https://www.reddit.com/gallery/rm6zxg,One month,1,0,1640185411.0,
rm1d00,https://www.reddit.com/r/bulimia/comments/rm1d00/im_scared_throwing_up_will_never_not_be_an_option/,i’m scared throwing up will never not be an option for me,16,0,1640164291.0,"i’ve been in recovery for around 6 months now, and i’ve gone 3 months not purging, then broke the streak, purged in singular moments here and there, but never had a purging episode since. i have been better at fighting the urges but whenever i do feel like i over ate or am too bloated/uncomfortable, i’m always like- well i can purge and i won’t feel this way. it happened tonight because i had only eaten two meals today and was a bit hungry, but eating at night is a trigger for me so i contemplated throwing up for an hour or so- but i finally did it. i’m just worried that i’ll never see this as something i absolutely can’t do? i understand that healing isn’t linear but i really want to stop purging completely. i feel so guilty after eating most days. i hate the holidays lol"
rm03fn,https://www.reddit.com/r/bulimia/comments/rm03fn/i_fucked_up/,I Fucked up,11,5,1640158936.0,"I admitted myself into inpatient thinking if it was too much/ not my thing I could leave since I’m over 18, turns out because my bloods are unstable they can force me to stay and even tube me... it’s only been one day so I’m not even thinking of leaving yet because I wanna give it a good try but just the thought of being forced is making me want to leave 🖕🏻"
rlzjgz,https://www.reddit.com/r/bulimia/comments/rlzjgz/not_the_bulimia_bloat/,Not the bulimia bloat....,11,4,1640156663.0,"I've really improved on reducing purging habits... however, I'm bloating like crazy. I've started running now that my family has a treadmill, and I think it's helped me understand my body a bit more. I've been able to understand better that ""good feeling"" I'd get after purging, was really just the endorphin/adrenaline response from the stress I was putting on my body-- I am able to feel those same responses from running and with better benefits. However bloating is not fun, neither is gas or pooping. I feel like a little pig. oink oink.

If anyone has any advice about reducing bloating or purging behaviours, let me know!"
rlye37,https://www.reddit.com/r/bulimia/comments/rlye37/throwing_up_blood/,throwing up blood,22,12,1640152376.0,"I purged an hour ago and there was some blood, it wasn’t very much but since then I’ve thrown up 8 times (involuntarily) and it’s been mostly blood every time. If it’s just my throat bleeding how long will it take to stop? Is there anything I should do?"
rly2hz,https://www.reddit.com/r/bulimia/comments/rly2hz/how_do_i_stop_this/,How do I stop this?,5,1,1640151218.0,"I’ve never had a healthy relationship with food and lately it’s been getting worse. For the past few weeks since Thanksgiving I’ve been binging and purging, and today I did it twice. I want to nip this in the bud before it can escalate to daily binging/purging, but I don’t know how to actually do that so I guess I’m just asking for advice."
rlwjt5,https://www.reddit.com/r/bulimia/comments/rlwjt5/i_could_just_blow_my_lid/,I Could Just Blow My Lid,14,7,1640145969.0,"I understand that family members, once they know, need to talk to someone to deal with supporting someone with an ED. But my sister has told mutual friends who I had not planned on telling and I can’t help but feel angry. It’s not her story to tell. If she needs to talk to someone she needs to get a therapist. I could just scream. I don’t want fucking pity. Or attention. That’s the last thing I want. 

Am I being ridiculous? Does she have the right to discus my ED with others?"
rlw9nz,/r/EdAnonymousAdults/comments/rlw964/i_cant_do_this/,I can’t do this,2,0,1640145058.0,[deleted]
rlw1m6,https://www.reddit.com/r/bulimia/comments/rlw1m6/deleted_by_user/,[deleted by user],3,2,1640144324.0,[removed]
rlw0y1,https://www.reddit.com/r/bulimia/comments/rlw0y1/why_is_it_so_extremely_hard_to_be_content_with/,why is it so extremely hard to be content with the way you look?,14,4,1640144263.0,"i was texting my boyfriend and mentioned how i couldn't eat that much with him because i am getting too fat. he replied like 'well, we'll just have oats and yogurt then' 
i feel so fucking stupid because it made me feel bad that he didn't say like noo babe you're not fat. i asked him if he thoufht i was actually fat and he said like ""so what if you were? i love you anyway"" and that he loves my belly and shit idk if thats supposed to be sweet but it made me feel like shit. i didn't reply anything because i know my image problems aren't his to deal with, i never talked about my ed with him either. he doesn't mean bad, it's me. i am the one with the problem.
i hate feeling like this all the time, taking extreme ofense in anyone mentioning weight (even if its not mine, just like having it come up in a convo triggers me) and like unless im extremely thin i have no value. like that will solve anything. when i actually was over 10kg lighter i was still hating myself, at the peak of my depression, self harming, puking everyday or not eating at all. when does it ever end? when can i stop caring so much about something so fucking stupid? sometimes it feels like the only way is to simply stop existing. maybe one day i'll do it"
rlvy99,https://www.reddit.com/r/bulimia/comments/rlvy99/deleted_by_user/,[deleted by user],3,3,1640144023.0,[removed]
