id,url,title,score,num_comments,created_utc,selftext
rfg6xi,https://www.reddit.com/r/bulimia/comments/rfg6xi/anyone_ever_binge_after_restricting_for_long/,anyone ever binge after restricting for long,8,1,1639403537.0,"
 May - July fell into a binge restrict cycle whilst experiencing extreme hunger due too heavy restriction for about 5 months. 

then Aug - Dec fell again into a mix of v low restriction, b/p, over exercise all, eating maintenence. all of it id experienced Until December.

But now for the past 2 weeks or so all ive done is fail restriction & basically binge, only purg!ng a little, a few times. 

ive probs been eating around maintenance, but still mainly vegan- ignoring timings and not rly measuring any food or cal counting which i feel so guilty for loosing even more control.  

my body is disgusting, im more depressed than ive ever been but i dont think thats soley from my ED; although the depression is fuelling it. 

 ive been ignoring my body and how it looks, not weighing or stressing over it only stressing over the loss of control and 'discipline' and my ed 'disappearing'.
 
now i feel like all im doing is eating & have little desire too restrict - waiting until its all too much & i can see again how quickly i can loose it all and get back too my lw. 

so uncomfortable with everything neither option seems appealing i keep telling myself if i reach below my lw by 31 jan (my bday) i can get help.

 i feel like i need too just get bored of eating and b repulsed by it until i can hardcore restrict again. i don't want to recover but i'm holding hope that by mid next year i will have gotten much much worse so maybe i can start then. ik u shouldn't wait till that point but i cant imagine rn wanting too let go of this life ever. 

i just want too shrivel & wither away. be left alone too starve w no responsibility for anything outside of existing. i hate this life. pissed i cant restrict as well as i used too and even more uncomfortable that part of me doesnt want too right now.  fml"
rffq8w,https://www.reddit.com/r/bulimia/comments/rffq8w/22m_and_i_guess_im_bulimic_would_like_to_get_some/,"22M and I guess I'm bulimic, would like to get some thoughts",24,13,1639402092.0,"Previously my built was athletic but after counting calories, i got overtly absurdly obsessed with calorie counting and body image as my environment tend to glorify masculinity. Therefore, I started exercising excessively and consuming low caloric food, restrictive eating, then it spiraled into volume eating and binging on such food while watching mukbang videos during the lockdown. To an extend, it felt like the lockdowns also played a part in triggering such P/b cycle as admittedly, I don't have much company so I would binge on low caloric food with those eating videos. After so, i lost an \~8kg of weight within 5 months

This has lead to several implications (some interesting & abnormal lab results):  


1. Blood test result: 
   1. Glucose, POCT: 9.mmol/l
   2. liver panel: 
      1. Alanine transaminase; 139U/L, 
      2. Aspartate Transaminase: 67 u/L
   3. Blood count:
      1. lymphocytes: 13.79%
      2. Neutrophils: 81%
      3. red blood cells: 3.94(x10\^6/uL)
      4. Haematocrit: 37.8%

Thereafter, i tried to gain back my weight and it lead to guilty binges and huge meals.  This would leave me feeling guilty and would try to restrict my next meals while exercising as much as I can. As of right now, I'm trying to seek ways to have proper meals, end of vent. :"")"
rfdi16,https://www.reddit.com/r/bulimia/comments/rfdi16/getting_help/,Getting Help,11,3,1639394277.0,"My mum found out, so she’s going to take me to the doctor in a couple of days. I feel extremely scared, I don’t know what to do. I know that this is a good thing, but I feel like my world is ending."
rfc8o2,https://www.reddit.com/r/bulimia/comments/rfc8o2/alright_i_did_something_terrifying_i_bought_100/,Alright I did something terrifying. I bought $100 worth of groceries and now have $160 worth of groceries in my house.,3,4,1639389145.0,"I just want to avoid the Christmas shopping and the supermarkets being cleaned out from next week. So I stocked up on meat and cheese and a bunch of essentials.

I did binge on a pack of cheese, 4 icecreams,2 blocks of chocolate, an entire packet of pasta with garlic and more cheese. I think that's all I ate. I wrote it down somewhere so I could calculate the calories later.

But I don't feel like I want to. I think I won't even have time to binge again until Saturday and then the following Monday 

But seriously pray for me. Realistically I have enough food to not need to entire a supermarket for about three weeks. (Well apart.from chocolate and a few little bits and pieces.)  This would have been undo-able a year ago. It would easily all be long gone in a few days.

I moved out of this awful sharehouse (the girl was trying to hassle me for thousands of dollars that she wasn't entitled to and wasn't agreed to it was meant to be first of the month$700. Follow the rules end of story, on top of the house being filthy and mouldy and surrounded by vermin and horrendous traffic and her yelling down the phone all day long) and back to my own house and the one upside was not feeling compelled to binge on groceries since she was around or out of tiredness because I had just made a long commute.

I have found being back to work has given me less time to binge and purge but I have noticed the magnitude when I do sky rocket."
rfbjos,https://www.reddit.com/r/bulimia/comments/rfbjos/im_worried_my_sister_might_be_purging_but_im_not/,I'm worried my sister might be purging but I'm not sure..,15,3,1639386195.0,"My sister eats EVERYTHING in the house.

I had 3 boxes of wafers I bought to have for a week as I am sick and stuck in my house to have with my tea and my sister straight up 6 PACKS OF THAT THING (half of everything I had for a week) with a whole box of cereal and she still wanted a sandwich with chocolate milk.

But somehow she is still losing weight? 

She doesn't smell like vomit and she doesn't take up time in the bathroom, her teeth are white and she's mostly never home so I dont know what she's doing.

I asked her if she's purging and she got very angry with me asking and beside denying it she yelled that it's none of my business and that I am disgusting for asking.

Maybe she isnt doing anything but she eats things that were meant to last for a 5 member family and we cant afford the amount of food she eats continuously.

I started hiding my food in my room because a weeklong supply ends in less than a day here..

She had anorexia in the past and was treated in a hospital before recovering to normal weight.

She's modeling for a loving which is why I'm concerned she's harming herself for her career..

Hoe can I tell if she's harming herself? She doesn't seem like she vomits but she eats inhuman amounts of food while still losing weight. I'm really confused and scared for her as she gets very angry when you ask about it.

What do I do? She's 17."
rf8swx,https://www.reddit.com/r/bulimia/comments/rf8swx/shout_out_to_those_here_with_eds/,Shout out to those here with EDs...,37,2,1639375412.0,"...ya'll are some of the most creative, compassionate, intelligent and determined people I have ever met. You are stronger than you think. You are so much more than this disease. Do not forget that."
rf8dk3,https://www.reddit.com/r/bulimia/comments/rf8dk3/awkward_moments/,Awkward Moments,7,1,1639373879.0,"Ever have those awkward moments with friends, where they are discussing how long they can go without eating. Then one pipes up and mentions how it sounds like they all have EDs. And you, with an ED (that they don’t know about) just sit there and laugh along with them at the “joke”, while feeling extremely exposed and ashamed… Yeah I had one of those moments today."
rf7lho,https://www.reddit.com/r/bulimia/comments/rf7lho/purging_for_loneliness/,Purging for loneliness,18,3,1639371318.0,"I’ve gotten to the point in my recovery where I don’t really care what my weight is. I don’t purge to get rid of calories or lose weight anymore. However, when I’m feeling lonely, I get an extreme urge to make myself throw up. I’ll sometimes go drink some water just so I can purge. Tell me I’m not the only one who does this…?"
rf7kui,https://www.reddit.com/r/bulimia/comments/rf7kui/struggling_not_to_purge/,Struggling not to purge,3,2,1639371261.0,[deleted]
rf5wqz,https://www.reddit.com/r/bulimia/comments/rf5wqz/hows_your_social_life/,How's your social life?,5,1,1639365912.0,"Are you happy around others , do you look like you're struggling with something , are you acting that everything is ok do you forget about your disorder when you are with others or ... Do you act like you're sad and worried , are you starting to become more distant? Maybe everything is the same as before ... Tell me about it , If you wish to share it my sweet boys and girls sorry I'm feeling flirty today 🤭"
rf3s98,https://www.reddit.com/r/bulimia/comments/rf3s98/1_12_years_clean/,1 1/2 years clean,14,1,1639359379.0,"I had a conversation with a friend earlier today that reminded me... It's officially been over 18 months since I ""quit."" It's not the right word, but it's the best way I can describe it. I really wanted to just share this realization with someone but I don't want to tell any of my friends. In addition, I've lost weight that I needed to in a HEALTHY way. I'm just so fucking ecstatic and I needed to express it."
rf2yxd,https://www.reddit.com/r/bulimia/comments/rf2yxd/im_the_worst_what_do_i_do/,I’m the worst. What do I do?,3,2,1639356946.0,I b/p’d 5 times in the last 24 hrs. I don’t know what to do
rf2arw,https://www.reddit.com/r/bulimia/comments/rf2arw/my_body_feels_off/,My body feels off,12,10,1639354807.0,"I've been bulimic for the last 6 or so years, purged every single day for all of those years and bped on kilos and kilos of food everyday. Abt 2 weeks ago I started getting extreme tightness in my chest and then on the Wednesday I woke up and could not eat at all, 3 bites and I am extremely full and uncomfortable and in pain. Literally overnight, I don't know how it's physically possible for my body to change so quickly especially as I've been boing for years so I thought my stomach was used to it. 
Since then my chest pain (particularly left) has increased, really heavy feeling heartbeat, my left arm aches all the time, my upper back is in pain, acid reflux is so bad, and overall I feel physically worse I've ever felt. Like a serious feeling of impending doom.
I had an ECG and bloods done less than 2 weeks ago and again a week before that and if was fine. But I feel off, like I'm afraid I'm going to die soon kind of off. 
I don't know what to do. The doctors are a nightmare to get a hold of.
PS I've been bp free since that day and free from purging almost entirely."
rf22q5,https://www.reddit.com/r/bulimia/comments/rf22q5/i_officially_regret_telling_my_mom_about_bp/,I officially regret telling my mom about b/p,37,6,1639354116.0,"This might be a little long and all over the place, sorry ):

So for context: at the beginning of this year, I was nearly 190 pounds (at 5'5). I've struggled with weight since elementary school, and have had a lot of weight fluctuations throughout the years, though I have always bounced between slightly heavier than average to straight up obese. My heaviest was just under 200 pounds. 

Spring of this year, I began a routine of heavily restricting and exercising daily. This resulted in a pretty dramatic weight loss (down to 134 was my lowest weight, last month). This was met with nothing but overwhelming praise and congratulations from anyone who knew me when I was fat. No one suspects anorexia unless you were already thin to begin with. Nevermind the hair loss, ghost-like face, or any other tip-offs - as long as you're skinny now, people consider it an improvement. Not that I would consider my ED to be anorexia, considering recent developments (and I have never been officially diagnosed). 

A couple weeks ago, series of life events that happened all at once triggered the start of a b/p cycle for me. Massive binges, followed by purging as close to all of it as I could possibly get, every single night, for just over a week. I was shocked at how quickly I got addicted to it, especially since I thought I had solid ""willpower"" from so many months of restriction. I'm sure a lot of you are familiar with how devastating it was (is). The mental, physical, and emotional toll it was taking on me in just 1 week was so much more than the months of restriction (at least, that's what it felt like to me). I had no energy, I got dizzy often, I couldn't sleep. I even developed a noticeable stutter, which I definitely didn't have before. I felt like my brain was only half functioning. 

Only after a night where I binged to such an extent that the only reason I didn't purge was because I was physically unable to move, and was stuck crying on the floor in intense pain, did I decide to open up to someone. I chose my mom, for a number of reasons; she is one of the only people I still talk to outside of work following these triggering life events, I was going to be around her for the following week so I thought maybe telling her would make me unable to have an opportunity to b/p, AND she herself has dealt with b/p in the past. 

Her reaction was less than ideal, to say the least. She was frustrated with me, and her initial advice, predictably, was to ""just stop."" When I tried to explain to her that I wanted to, of course I wanted to, but it felt impossible, and I didn't know how, she instead made a ""game plan"" - one that involved getting back on track with restriction. 

The following week really sucked. I didn't binge or purge, which should feel like a victory, but it doesn't. She commented on every single thing I would eat, discouraged me from eating, constantly said I should stick to eating only fruits and vegetables, all the while she was eating snacks/sweets. 

The worst moment was when we were in a cafe for lunch, and I hadn't eaten breakfast that morning or dinner the night before. She literally took the food out of my hand and put it back in the bag, saying I could eat it later when I decided if I was ""actually hungry."" I tried to tell her, in the least confrontational way possible, that her method of preventing me from binging was upsetting to me, and she got defensive, saying ""I thought you wanted me to help?""

Another not fun moment was going with her to her house last night, and seeing a counter full of junk food. She made sure to announce to the rest of the household, ""we have to hide this junk food from [my name]. She's skinny now and we don't want to ruin it.""

Today, I'm on my own again. I haven't binged or purged, nor do I feel the urge to (I think...). In fact, I think I'm back in the restricting mindset, for better or for worse. But after opening the floodgates of b/p, it feels like it's looming in the background as a possibility now, waiting for the tiniest slip-up in my restriction. 

I thought I was taking a positive step. Now I feel more than ever like there is no escape from this ED cycle I've found myself in. 

I know this is mostly a ramble/rant, but if any of you have dealt with something similar, I would appreciate any words you have to share."
rf0sb9,https://www.reddit.com/r/bulimia/comments/rf0sb9/deleted_by_user/,[deleted by user],1,0,1639350323.0,[removed]
rf0ljk,https://www.reddit.com/r/bulimia/comments/rf0ljk/who_have_you_told/,Who have you told?,3,3,1639349795.0,Im afraid to tell anyone. My husband is the only one who knows at the moment and he doesn’t know what to do. He respects my choice not to tell anyone but he really wants me to my mom when we go home for the holidays. I’m afraid if I tell her she won’t understand but also mainly that I’ll be “watched” and right now I feel like I’m able to purge still in secret which is obviously not the way to get better. It’s like I WANT to get better but secretly I dont. I also feel like a fraud… like I’ve lost a lot of weight Bc of purging and I’m scared of what ppl will think. I just can’t tell anyone. Have y’all told anyone? How did it go? Should I tell my mom? We are pretty close… I’m just not ready. But I’m really hoping to stop as a New Years resolution.
rf0jsg,https://www.reddit.com/r/bulimia/comments/rf0jsg/does_anyone_else_have_an_issue_with_this_too/,Does anyone else have an issue with this too?,3,0,1639349653.0,I am coming to ask this question as I was just diagnosed with bulimia and was wondering if anyone has issues with this too. I have purged a few times in the past few days. Oddly enough part of it was a response to being told I’m bulimic. Don’t understand that one. Today I have shifted gears and have started to go back to a calorie counting thing I used to do a few years ago. It’s very bad. I look at calories and what is recommended for daily weight loss(I’m plus size by the way)and I know what’s considered healthy but I freak out if I eat or drink any thing over 800 calories a day. I know this is bad. I haven’t told my therapist about this yet. He knows I sometimes do intermittent fasting and said that that’s not good for me either. Fasting and vomiting help me feel in control. When I eat I feel lost. I don’t know how I’m gonna get over this.
rezqup,https://www.reddit.com/r/bulimia/comments/rezqup/why_not_to_not_start/,Why not to not start?,3,1,1639347305.0,"What would you tell your younger self (or someone you know) to get them to not start?

If you could go back in time, or maybe know someone in your life who is about to go down this horrible path, what would you say to stop them from starting this? Maybe you would not listen to yourself, but what do you think would MAYBE get you to listen and not start ruining your body?"
rey1mo,https://www.reddit.com/r/bulimia/comments/rey1mo/read_this_pls_i_need_help/,Read this pls I need help,22,5,1639342451.0,"I developed bulimia when i was 15.
At 17 i acquired the ability to purge without really inducing it. I regurgitate, all I need to do is to flex my abs, lean over the toilet and everything is gone in less than a minute. It made me lose 13kgs (≈29lbs) in a month. It got so bad I now purge at least 8times a day. I purge everything that goes into my mouth (even water or diet sodas on an empty stomach). I steal food bc I dont have enough money to satisfy my urges. Does anyone have this type of bulimia? I feel like a drug addict, stealing money and food so i can get my “high” 
Thanks for reading this ;)"
rewfiu,https://www.reddit.com/r/bulimia/comments/rewfiu/its_been_4_days_since_i_last_binged/,It's been 4 days since i last binged!!!!,41,3,1639337788.0,"I have been binge eating every single day since January 2019. Every day. I don't know how i did it, but the last time i over-ate was Wednesday. I don't have a ton of friends or people who i can talk openly about my ED with, so i just wanted to share.
The cravings are real and it's all i want to do, but i'm finally starting to believe in myself again. I had no faith in recovering. And now i finally do!!!!"
rew808,https://www.reddit.com/r/bulimia/comments/rew808/deleted_by_user/,[deleted by user],1,0,1639337209.0,[removed]
repc99,https://www.reddit.com/r/bulimia/comments/repc99/venting_about_me_and_my_mum_fighting_trigger/,Venting about me and my mum fighting (trigger warning!),2,2,1639316830.0,"just had a massive fight with my mum as she came into the kitchen while i was binging (i just came out of 8 weeks in a residential treatment facility but clearly havent gotten better :( which she doesn't understand why) this lead to her storming up stairs to proceed to punch the mirror in her room smashing it all over the floor as well as cut her own wrist (she has a history of self harm) i then had to wipe up the blood that she'd smeared all over her face and that was dripping out of the wound and basically had to pretend like im okay with all of this happening by watching a 2 hour long movie with her in order to make her happier, after helping her wash up because she was lying on the floor saying her blood was going to make her pass out. what the fuck has my life come to. my mum always makes out that my disorder is directly harming her then does this stuff basically to spite me.... great"
reob8m,https://www.reddit.com/r/bulimia/comments/reob8m/losing_weight_after_a_binge/,losing weight after a binge?,1,1,1639313053.0,has anyone ever lost 5+ pounds after a few days of bingeing? with no purging? what’s up with that?
renzqr,https://www.reddit.com/r/bulimia/comments/renzqr/deleted_by_user/,[deleted by user],5,2,1639311821.0,[removed]
rem0m5,https://www.reddit.com/r/bulimia/comments/rem0m5/i_just_purged_for_the_first_time_in_my_29_years/,I just purged for the first time in my 29 years of life.,39,26,1639303375.0,"My stomach hurts but other than that I feel okay. I was alone. I made sure to brush, floss, and throughly rinse.

I just thought hey now that this is what we do I wonder if there's a sub for it. And lo and behold.

I wish I didn't do that. I'm not gonna be able to prevent myself from doing it again, though.

I'm just alone. Always have been."
relqim,https://www.reddit.com/r/bulimia/comments/relqim/how_old_were_you_when_you_became_bulimic/,How old were you when you became bulimic?,23,32,1639302178.0,"Personally, I was 12 when I became bulimic. How old were you? If you don’t mind me asking, how did it effect you at the time, compared to how it affected you in the future?"
rel371,https://www.reddit.com/r/bulimia/comments/rel371/deleted_by_user/,[deleted by user],5,1,1639299462.0,[removed]
reh8t2,https://i.redd.it/0ivl3a6yj1581.jpg,"Vocal cords they don’t have any mucus , do you guys think this is dehydration ? , I used to throw up a lot",1,1,1639284169.0,
rege7i,https://www.reddit.com/r/bulimia/comments/rege7i/help_im_starting_to_develop_eating_disorder/,Help - I’m starting to develop eating disorder,4,2,1639281239.0,"I’m a healthy weight athletic person 23F and I work out 3-4 times a week. I always struggled with body image due to playing competitive sports and being in very toxic environments. Over the past few months I have started obsessively calorie counting (first in my head, then recording it), and making myself subtract calories from my “budget” if I went over the previous day which can lead to starving myself. The past week I’ve had a lot of family food events where I’ve overeaten which has led to me to feel really guilty. Today I purged for the first time and it felt way too easy. I need to stop this before it gets worse but I don’t know how - I already tried deleting my calorie document but I just kept track subconsciously and started it up again after half a day."
refi6f,https://www.reddit.com/r/bulimia/comments/refi6f/tw_what_a_series_of_events/,tw what a series of events,2,0,1639278125.0,"tmi but oh god. today was eventful i tell you

was working on late notice today, i had already eaten since i wasnt planning on anything else to be honest. was nearly caught in the bathroom when i had my break, nearly gave me a another ed induced heart attack ! then had a kind of family get together after work; yk how it goes (woah food!) not sure what happened, fainted on the stairs and obvs went tumbling. decided to go home, but then i still managed to eat god knows what. i never actually really binge a magnitude of food, its just everything to my brain is a binge if its eating. i also made some baked goods (no, werent too good),, but since i already ate earlier my brain took me where i needed to go, the toliet (god my neck and back hurt more than my throat did) and then oh lord, i was trying to switch the music on my phone i was putting on to drown the noise out (so it seems like i still have dignity) and i dropped it. in the toliet. into my puke. also, something i wish everyone who is just starting to purge is that the smell never gets off your hands, its like ingrained down to the bone. though i think im desensitized to touching my own sick. it did not help me fishing my phone out of the toliet and running to get something to dry it with (*it* got and went everywhere. the seat, the towels, the sink, the counters and even some handprint on the wall. what the fuck?)

im feeling very tired. my heads pounding even louder than usual. and yet i feel comforted by what i did, the wind is very nice outside tonight.

what has my eds costed ? a lot but at the most i can add my phone to the list (its sitting in rice, waiting for results)"
recnfq,https://www.reddit.com/r/bulimia/comments/recnfq/please_help_me/,Please help me,17,11,1639268687.0,I just ate some of my husbands homemade Mac & Cheese and like a quarter of a biscuit doused in gravy. On top of my own healthy dinner. Please help me because I want so badly to throw this up. Just what I ate from his plate. The urges are so strong and it’s killing me.
reb84l,https://www.reddit.com/r/bulimia/comments/reb84l/im_relapsing/,I’m relapsing,8,1,1639264119.0,"I’ve been in recovery for about 6 months now and was feeling great, going to the gym, and eating 3 meals a day. I have been at home for 10 days straight because my job made me quarantine and now I’m relapsing. The feeling of guilt when I decide not to go to the gym is so strong that my brain tells me I don’t deserve to eat and when I ignore that voice, I end up purging my dinner. I just don’t know how to stop this way of thinking. It feels like it’s out of my control."
reb14v,https://www.reddit.com/r/bulimia/comments/reb14v/betterhelp/,BetterHelp???,2,0,1639263539.0,Had anyone tried better help for ED-related therapy? At this point I just need to talk to ANYONE.
