id,url,title,score,num_comments,created_utc,selftext
rszpe4,https://www.reddit.com/gallery/rszpe4,Goal for 2022: overcome bulimia! I can do it! You can do it! Let’s be kinder to ourselves in this new year! 🤎❤️,25,1,1640974147.0,
rsz0h1,https://www.reddit.com/r/bulimia/comments/rsz0h1/deleted_by_user/,[deleted by user],3,2,1640972195.0,[removed]
rsyr9y,https://www.reddit.com/r/bulimia/comments/rsyr9y/my_therapist_never_took_it_seriously/,My therapist never took it seriously,9,2,1640971480.0,"I used to be in therapy and this one therapist before I quit I talked to abt my bulimia. He told me he wasn’t worried if it was for looks/to attract others because I’m already hot or something like that. And a year later I’m still a bulimic so. 

After I quit therapy my mom wanted me to talk to him one last time before I left, he said unprompted “and you’re not vomiting anymore right,” and I go, “yeah…” 

Sorry for formatting, I’m on mobile rn. I didn’t really know where I was going with this."
rsyp88,https://www.reddit.com/r/bulimia/comments/rsyp88/im_about_to_hit_10_days_bp_free/,Im about to hit 10 days b/p free,104,20,1640971320.0,"The longest streak I had before this was 6 days, in the 3 years ive been doing this. Just wanted to share because im very proud of this little victory. On another note, every time i eat i (tmi) have to burp and end up throwing up in my mouth. Throat is broken 😞 Hope everyone is doing well, much love!"
rsu167,https://www.reddit.com/r/bulimia/comments/rsu167/i_need_someone_to_talk_sense_into_me/,I need someone to talk sense into me,14,10,1640957669.0,"I can't sleep because I don't eat enough and am constantly thinking about food.
I can't get through a single day without purging. 
I eat other people's food and my parents have a separate fridge that everyone is allowed to go in besides me, my parents lock up food downstairs (an actual room with a lock on the door) that everyone has the key to except me. 
Constant arguments about me eating too much and eating food I'm not allowed to eat. My family does not keep any sweet things around and they do not buy me any bad food, so when I get it, I really want it. 
Every time we eat out or order food, or get any ""unhealthy"" food, there is so much tension because everyone is afraid I'll eat too much and purge
I get screamed at and shamed whenever I eat other people's food and have to pay money for what I ate (I don't have a job or a stable source of income so this is hard)
My family does not keep any unhealthy food where I access it so there is no balance of healthy and unhealthy in my diet
My parents are thinking about putting a lock on the fridge and pantry, and I cannot even began to say how humiliating that would be. I am beside myself. 
I am a healthy weight (bmi 20.8), 17 yr female, had an eating disorder for 7 years. I want to lose more weight so bad (I want a bmi of 15.9) so this is why I purge so much. And I have constant craving due to not eating enough (bc I want to lose), thus the binging and purging.
This is all just so embarrassing and humiliating and I just want to crawl up and hide. I'm not happy and all I think about is food, my body, my weight. I am extremely aggressive around food. I become so irritable. I have small cavities in all my teeth, I'm constantly freezing and lightheaded. It's just terrible. I need a sense of directions. How can I help myself and how can my parents helps me?"
rstzie,https://www.reddit.com/r/bulimia/comments/rstzie/i_want_to_binge_so_bad/,I want to binge so bad,6,1,1640957517.0,I suffer from anorexia and bulimia and recently my bulimia has been very very bad again and I manganese go to binge and purge yesterday but I’m having strong urges to now I need to binge so badly I really need to
rsqa5e,https://www.reddit.com/r/bulimia/comments/rsqa5e/i_feel_so_humiliated/,I feel so humiliated,12,3,1640943307.0,"My (23F) mom just called me over to poke and feel my stomach because she’s “not used to me having a stomach” and she wanted to feel it and “make sure I’m not pregnant”. She just poked and squeezed and rubbed my fat, and then made a comment about how I could’ve just told her I wasn’t pregnant when I turned away. 

I feel so humiliated. I’ve never wanted to change my body more. I feel so disgusting and gross. The only thing I can think to describe it is a blob. I feel like a giant blob. I know I’ve gained weight. I can see it. I can feel it. I’m stuck with it. I’m disgusted with it. She doesn’t need to point it out. She doesn’t have to make me feel even worse. I’ve had an eating disorder for so long. OSFED, then just cycling between anorexia and bulimia throughout high school and college, BED when I graduated, and now I’m back to bulimia. I haven’t purged in 3 weeks. I’d wanted to start 2022 better. But now I already know I’m going to purge tomorrow’s big NYE dinner. And I feel so guilty and small. My boyfriend has been helping me with my bulimia and trying to get me to actually like my body (which I’ve never done) and with one comment from my mom I’m spiraling. Again."
rspiam,https://www.reddit.com/r/bulimia/comments/rspiam/i_am_so_tired_of_feeling_ugly/,I am so tired of feeling ugly.,34,8,1640940140.0,"It’s not fact but a feeling, felt most profoundly during those miserably dark hours dominated by food."
rsoivn,https://www.reddit.com/r/bulimia/comments/rsoivn/the_worst_thing_when_the_food_wasnt_even_worth_it/,The worst thing when the food wasn’t even worth it…,96,8,1640936248.0,
rsob3o,https://www.reddit.com/r/bulimia/comments/rsob3o/here_are_some_habits_i_hope_to_break_during/,Here are some habits I hope to break during recovery :),8,2,1640935385.0,"I suffered with anorexia, binge eating disorder, AFRID, body dysmorphia disorder and bulimia for years before I started my recovery journey. I want to share my journey with you, and hopefully help all of you with your recovery :) we all deserve a good relationship with food!

The habits I plan to break:

• ruining food so that I can’t eat it

• immediately checking the nutritional facts on everything I’m eating

• avoiding food I crave just because it is deemed “unhealthy” by diet culture

• sneaking food so nobody sees me eat

• no liquid calories whatsoever

• refusing food I know I like due to judgement

• never trying new food due to fear of allergic reaction

• never eating in front of people

• exercising before and after I eat

• laxative pill abuse

• buying things I want to eat them throwing them away so I can’t binge on them

• only eating at 6:30

• only eating one food at a time

• cutting everything up in small bites

• waiting 15 minutes after i eat anything in case of allergic reaction

• weighing myself every morning and after I eat anything

• measuring my thighs and waist everyday

• tracking my calories everyday 


We all deserve to recover and I want to help everyone I can! Here is to a happy and healthy life with food :) I’m here for all of you!"
rsn080,https://www.reddit.com/r/bulimia/comments/rsn080/i_was_clean_for_12_days_from_bp_and_i_messed_up/,I was clean for 12 days from b/p and I messed up.,6,3,1640930486.0,I was clean from b/p for 12 days and I messed it up today. It was the longest I had been in a while. Had a really stressful day. On top of that I had to make a dentist appointment for a tooth problem and I’m scared. What’s messed up is how much I wanted to do it. I just couldn’t hold the urges back anymore. I’m so mad at myself. I hate that I messed up
rsmnp5,https://www.reddit.com/r/bulimia/comments/rsmnp5/i_want_to_relapse/,I want to relapse,6,1,1640929272.0,"They say that habits are built in 60 days, so I tried to go 60 days b/p free. 

Well, I’m on day 73 and I still want to relapse. I miss my disorder. I’ve been seriously miserable since I stopped binging and purging. It was my comfort, the only thing I could rely on. The worst part is, I’m still binging and I’m gaining weight rapidly. I just want to go back to my old habits.

Will the urges really ever go away? I don’t see the point in “recovery” when I just feel absolutely miserable every single day."
rsloh8,https://www.reddit.com/r/bulimia/comments/rsloh8/covid_19_and_bulimia/,Covid 19 and Bulimia,6,0,1640925928.0,[deleted]
rsi3u9,https://www.reddit.com/r/bulimia/comments/rsi3u9/tw_back_of_hand_is_dry/,TW: Back of Hand Is Dry,5,1,1640914795.0,"I don’t have calluses or anything but the back of the only hand I use is like soooo rough. Just feels like dry skin but it’s weird that it’s only on one not both hands. Could this be from b/p? It feels horrible. Hand just looks slightly sunburn, like a little peely. Anyone else get this?"
rsgemm,https://www.reddit.com/r/bulimia/comments/rsgemm/cant_purge_stressing_about_it/,Can’t purge & stressing about it,7,3,1640909721.0,"I haven’t eaten all day really (not by choice, but just the circumstance). I went out for dinner with people - finally - real food…but a hefty, caloric meal and though I felt satisfied when we left, I’m back home and feeling full (a trigger) and I’m just trying to get through this. I feel like I’m gonna gain weight. I’m panicking. And I am not in a situation I can purge. It like makes me kind of angry… but I know it’s for the best? Ughhh."
rsg5d0,https://www.reddit.com/r/bulimia/comments/rsg5d0/i_dont_know_under_which_ed_i_fall/,i don’t know under which ed i fall,6,1,1640908974.0,[deleted]
rsfz49,https://www.reddit.com/r/bulimia/comments/rsfz49/what_is_the_exact_definition_of_bulimia/,What is the exact definition of bulimia?,3,2,1640908484.0,"I've had this on the mind since I started watching a lot of Erik the Electric vids, and a lot of people in the comments claim he is bulimic in the form of having planned binges (eating challenges/""cheat days"") coupled with extreme amounts of cardio and restriction the rest of the week in order to maintain his weight/physique. 

I've seen a lot of different definitions thrown around here, and I was wondering what the official criteria is that makes something bulimia as opposed to EDNOS, BED, or anorexia b/p subtype. 

Like, does any extreme compensatory behavior count as purging (like fasting or excessive exercise) or is it only vomiting and/or laxatives? 

Also, does the type of binge count (""planned"" vs ""unplanned"")? 

What if you have long periods of just restriction in between? How often does the b/p have to occur to count as bulimia? 

I'm also wondering in regards to myself, because after months of only restriction (what I would have thought of as anorexia: rapid weight loss, intense fear of food/weight gain), I fell into a week of standard b/p (unplanned binges followed by puking, daily), and now I'm in a new pattern of having a ""cheat day"" followed by fasting, excessive exercise, and restriction."
rseo0n,https://www.reddit.com/r/bulimia/comments/rseo0n/relapse_again/,"Relapse, again",2,1,1640904847.0,[deleted]
rsebp2,https://www.reddit.com/r/bulimia/comments/rsebp2/for_those_of_you_who_hit_your_goal_weight_was_it/,"For those of you who hit your ""goal weight"", was it ever enough?",6,4,1640903935.0,"I keep telling myself ""just another 5 pounds, and I'll be happy with my body,"" then I lose another 5 pounds and hate my body even more because it looks the same. Does the ""goal"" always keep lowering, or has anyone actually met their goal and been satisfied?"
rse43o,https://www.reddit.com/r/bulimia/comments/rse43o/binged/,binged,3,0,1640903380.0,I binged on choco mudcake and that shit is impossible to purge esp when u have it first thing on an empty stonach. binged on others but omfg the mudcake lol
rsdvil,https://www.reddit.com/r/bulimia/comments/rsdvil/period/,Period,2,0,1640902731.0,"Hello , I was anorexic for a small period of my life but I can’t consider myself as severely underweight. Now I think I’m bulimic and mainly at the days of my period besides the fact I lost it for 5 months. I don’t know what is going on and what I have to do! Also I want to add that I’m in a healthy weight right now"
rsdc20,https://www.reddit.com/r/bulimia/comments/rsdc20/this_is_stupid_but/,This is stupid but...,4,2,1640901318.0,"I don't want to recover from ed. I just want to stop bingeing. I can't (or don't want to bc l'm afraid of getting fat) stop purging before l stop bingeing.

So if you please wouldn't focuse on that l don't want to recover, do you have any idea how l could end bingeing?

I binge for stress, for generally bad feeling (sorrow, depression, lonelines, usually mixed) or when l'm bored (not intentionally).
I purge when l feel too full or when l want to have feeling of control from myself."
rsbvmy,https://www.reddit.com/r/bulimia/comments/rsbvmy/omg_ahhhhhhb/,Omg ahhhhhhb,4,2,1640897548.0,[deleted]
rs9ry6,https://www.reddit.com/r/bulimia/comments/rs9ry6/relationships_and_recovery/,Relationships and recovery,7,4,1640892090.0,"My referral to outpatients is going to take 8 months so the doctor has sent me a book called Getting Better Bite by Bite to start working through alone.

I started reading today. Cried twice, which is a big deal for me as I'm autistic and not very demonstrative with my emotions. I did my yoga and at the end Adriene said to say something kind to yourself, I said ""you don't deserve this"", and cried again. I did the first two exercises in the book, which are about pros and cons of recovery to you and others, and your fears, basically. Also two letters from future you, one if things are going well, and one if they're not.

I have already mentioned to two (supposedly good) friends who I had fairly imminent food-related plans with (bottomless brunch and an afternoon tea) that I'm going through a hard time and might need to postpone or change plans because of the work I need to start. I think having plans not being focused on food is important for my recovery now. 

One hasn't responded at all, one said ""oh OK"", and nothing else.

A big part of my ""cons"" was what people would think and if they would like me less or think I was selfish for being more assertive about what isn't helpful for me right now and this is not helping.

I think a really difficult part of this is going to be acknowledging that some relationships are not going to come forward with me... and I am so insecure and needy (autism!) I will find that very hard. 

Luckily two other friends were much nicer about it. But I think this journey will be an eye opener."
rs9mkk,https://www.reddit.com/r/bulimia/comments/rs9mkk/cooking/,Cooking,2,0,1640891706.0,"Like wtf
Why is it so Hard to go the kitchrn
But not to order dinner for 3 at macdonalds"
rs9iv0,https://www.reddit.com/r/bulimia/comments/rs9iv0/i_record_myself_purging_confession/,I record myself purging (confession),27,4,1640891437.0,I’m about to turn 22 which marks 9 years since I purged for the first time. For the past year I’ve been video recording every purge I have in the hopes that seeing myself do what I do wil make me stop at some point. But every time I watch a video I see the way I look and I feel like I should purge even more. I have maybe a hundred videos of myself purging. Sometimes I think about selling them to fetish sites.
rs9fwd,https://www.reddit.com/r/bulimia/comments/rs9fwd/asking_for_a_friend/,Asking for a friend,3,0,1640891230.0,[deleted]
rs9coc,https://i.redd.it/x6xzm5ww9q881.jpg,Little recovery update :),42,9,1640891009.0,
rs8dyz,https://www.reddit.com/r/bulimia/comments/rs8dyz/deleted_by_user/,[deleted by user],1,0,1640888569.0,[removed]
rs7d08,https://www.reddit.com/r/bulimia/comments/rs7d08/does_anyone_have_any_protein_bars_they_really_like/,Does anyone have any protein bars they really like?,18,30,1640885962.0,
rs78gy,https://www.reddit.com/r/bulimia/comments/rs78gy/what_meals_from_any_fast_food_restaurants_are_you/,What meals from any fast food restaurants are you comfortable eating?,58,111,1640885640.0,
rs780w,https://www.reddit.com/r/bulimia/comments/rs780w/i_think_i_ruined_my_gag_reflex/,I think I ruined my gag reflex,1,2,1640885608.0,[removed]
rs75d8,https://www.reddit.com/r/bulimia/comments/rs75d8/all_of_my_dogs_chew_toys_are_food_shapedinspired/,"All of my dogs chew toys are food shaped/inspired, because I find it somewhat therapeutic. Is this weird?",3,1,1640885420.0,
rs72vw,https://www.reddit.com/r/bulimia/comments/rs72vw/you_know_you_have_a_problem_when/,You know you have a problem when...,10,2,1640885248.0,"You somehow end up making a mess while purging and have to clean it up. I purged a bit ago and it was a lot more watery than I expected, and some went out to the floor... and I got some on a rug, staining it a bit. I managed to clean a lot of it, but for the bits I couldn't get off of the edge, i'm hoping it goes unnoticed.   


Anyone else have some other ones?"
rs6sz8,https://www.reddit.com/r/bulimia/comments/rs6sz8/binged/,binged .,9,3,1640884535.0,[deleted]
rs6mda,https://www.reddit.com/r/bulimia/comments/rs6mda/bp_yesterday_and_was_going_to_fast_today_but_im/,B/P yesterday and was going to fast today but i’m starving this morning… why? Normally i’m still full from the binge even if i purged most of it.,2,1,1640884069.0,
rs5jk3,https://www.reddit.com/r/bulimia/comments/rs5jk3/if_anyone_ever_needs_to_talk_im_here_for_all_of/,"If anyone ever needs to talk, I’m here for all of you! If you are having a bad day, or struggling for a moment…I’ve got your back! Don’t be afraid to reach out :)",3,0,1640881270.0,
rs4g1y,https://www.reddit.com/r/bulimia/comments/rs4g1y/what_are_your_safe_foods/,What are your safe foods?,28,48,1640878366.0,
rs47rt,https://www.reddit.com/r/bulimia/comments/rs47rt/should_i_start_talking_to_my_therapist_about_my/,Should I start talking to my therapist about my ED/ recovery?,6,3,1640877764.0,"The obvious answer seems to be yes, but I need some advice from this community. My bulimia started in high school. I’m now 26 and finally beginning recovery. This year has been a monumental shift: I worked through the Intuitive Eating Workbook, confided in two friends plus my dentist, and started moving away from b/p behavior. I am officially 4 months b/p free and mostly eat intuitively. It feels awesome and crazy to have come this far. 

Sometimes I worry that I will have a slip up in the future and I won’t know how to get back on track. I have been seeing a therapist for other things, and would like to talk to him about this as well. But, I know it’s not his specialty and the thought of finding a new therapist is overwhelming. Also, I worry that if someone else is part of my recovery, it will feel less “mine” and something will go wrong. I know this sounds irrational. If anyone has a perspective, I would love to hear your thoughts."
rs3yj4,https://www.reddit.com/r/bulimia/comments/rs3yj4/im_scared_of_gaining_weight_but_not_eating/,I’m scared of gaining weight but not eating?,5,1,1640877061.0,"Does anyone else want to eat and feels comfortable about eating certain foods they used to be scared of eating…but then they realize that they will gain weight and do it quickly due to anorexia, so you decide not to?"
rs3p77,https://www.reddit.com/r/bulimia/comments/rs3p77/is_115_lbs_average_weight_for_a_18_year_old/,"Is 115 lbs. average weight for a 18 year old, female, and 5’5?",1,2,1640876372.0,[deleted]
rs35uj,https://www.reddit.com/r/bulimia/comments/rs35uj/what_was_the_hardest_habit_to_break_during_your/,What was the hardest habit to break during your recovery?,3,3,1640874812.0,I used to spit all the time after I ate anything…something in my brain told me that it got rid of calories. It’s still something I try not to do.
rry1cy,https://www.reddit.com/r/bulimia/comments/rry1cy/how_can_i_hydrate_myself_and_get_my/,How can I hydrate myself and get my electrolytes/potassium back to “normal”?,2,7,1640857722.0,"I want to recover but I’m in the mental process of accepting that. I’m trying to not binge and purge and at this point, I get so stressed when I do because I feel the physical effects it’s having on me and I can see the tooth damage. 

I am always severely dehydrated and drinking water is not enough. I am very bad about taking care of myself, so when I purge I hardly drink water. It’s usually Coke Zero. But I’m having health problems now and I can’t figure out how to become hydrated. I just had blood work done and the levels aren’t normal. 

Should I drink a pedialyte every day? This may sound so dumb, I just want to try to be healthier and this is a priority. I feel like my heart is giving out. 

Thank you for anyone that reads this. I really need help right now and I can’t find anything online about how I can get my electrolytes back to “normal” levels. I can only seem to find information about how bulimia “wreaks havoc on the body” and about how purging affects my heart and organs and then in the same breath say, “if you or someone you know has bulimia, here’s a phone number” I’m trying but these resources are not giving me information about anything other than dying."
rrxwj2,https://www.reddit.com/r/bulimia/comments/rrxwj2/there_is_hope/,There is hope,25,1,1640857229.0,"I had bulimia for 6 years. I used to binge 5 to 9 times a day and purge more than that. I used to purge water and healthy safe foods. I weighed 44kg as 21 year old and it made me feel beautiful and empowered. Last year, I had no motivation to quit and I quietly embraced the fact that I will die young because of my disease. Throughout the last year, I had horrible dreams about my demise, saw terrible pictures of girls who died because of bulimia, and felt like I didn't want to be like them even though I am one of them, or was. I am just too frightened of death and the whole idea of causing such horror to the people close to me - and who are aware of my disease - is unsettling. So I decided to quit it. And I couldn't. I lied to those who are closest to me and who were monitoring my eating habits as I was purging small nutritious meals. And then I tried to convince myself that I need energy for school and work and it is unfathomable that a human body can survive like this. I started keeping down the most measly and basic foods like fruits and some veggies and maybe some meat. Gradually, I was able to have a full meal in a day but nothing else since I am still haunted by the body-perfect obligations that I had made for myself. Then, the most unexpected thing happened. I didn't gain weight! Maybe 1 or 2 kgs but not that alarming at all. It took so many years to realize that eating amounts of food correspondant to your body needs maintains your weight and doesn't make you gain any. I started being regular and saw my body change for the better. A few weeks a go I started BP again like twice a week but I stopped again because I REALLY want to heal. The road is tough and takes time but believe me, IT IS WORTH IT."
rru0ty,https://www.reddit.com/r/bulimia/comments/rru0ty/i_cant_stop_bingeing_but_cant_continue_to_purge/,I can’t stop bingeing but can’t continue to purge afterward. I have been gaining weight but it’s been addicting I just act impulsively and can’t stop. I feel so fat and feel like my stomach is about to explode. I’m so disgusting.,10,0,1640843403.0,
rrthpa,https://www.reddit.com/r/bulimia/comments/rrthpa/motivation_to_recover/,Motivation to Recover,23,1,1640841690.0,"Hi, I’m a psych student and I’ve recovered from bulimia. These are things that helped me a lot.

1. Not everyone is going to like you even if you’re skinny. *everyone likes different things and sometimes you aren’t going to be one of them, that’s okay*

2. Wanting to quit. *bulimia comes with severe anxiety and depression, bulimia is making you miserable. Your teeth will decay from the acid, you’ll get these weird heart palpitations if you haven’t already.*

3. Spicy omelettes. Too spicy to barf up and too healthy to have (heavy) intrusive thoughts about. Find your own spicy omelette. 

4. This is where the psych training comes in. Sometimes bulimia is used as a way to control life when it’s out of YOUR control. Notice when your using purging and as stress relief"
rrthbg,https://www.reddit.com/r/bulimia/comments/rrthbg/is_it_still_good_to_track_calories_even_during/,"Is it still good to track calories even during recovery, or should I try to let that habit go?",2,6,1640841657.0,
rrtbyd,https://www.reddit.com/r/bulimia/comments/rrtbyd/what_are_everyones_trigger_foods/,What are everyone’s trigger foods?,1,5,1640841188.0,[removed]
rrszds,https://www.reddit.com/r/bulimia/comments/rrszds/is_this_normal/,Is this normal?,2,2,1640840148.0,"I feel the need to write the calorie contents of everything on every fast food restaurant menu, every candy, every snack, every product from certain brands, and the list goes on…

I don’t know why but it makes me feel better to know the calories or at least know I have them written down somewhere, even though I know I’m not gonna eat the food or snack that I’m writing about.

I already have journals full of the nutritional facts of every food I could think of, even the ones I dislike just because I feel addicted to know all the nutritional facts about all food.

Is this normal?"
